<?xml version="1.0" encoding="UTF-8"?>
<arqueologia xmlns:xsi="http://www.w3.org/2001/XMLSchema-instance" xsi:noNamespaceSchemaLocation="jpsanchez_a2_act8_ex3.xsd">
    <jaciment epoca="pre-romanic">
        <localitzacio>
            <nom_pais>Italia</nom_pais>
            <nom_ciutat>Roma</nom_ciutat>
            <coordenades>
                <longitud>275.3</longitud>
                <latitud>145.6</latitud>
                <orientacio>NE</orientacio>
            </coordenades>
        </localitzacio>
        <troballes>
            <peça id="_12" >
                <descripcio>Trident coure</descripcio>
                <data>1990-08-25</data>
            </peça>
        </troballes>
    </jaciment>
</arqueologia>